Key,English (United States)(en-US),Korean (South Korea)(ko-KR)
TM_L0001,"Humans have a round head, flat\nbody, long stick-like arms and legs,","인간은 동그란 머리 하나와 판판한 몸, \n기다란 선 같은 팔다리를 가지고 있는데,"
TM_L0002,"and at the end of each limb are no more than\nfive fingers and toes, flexing intricately.",그 팔다리 네 개 끝에는 정교하게 꼬물거리는\n손발가락들이 무려 다섯 개나 달려 있어.
TM_L0003,And they grow loooong hair to\nprotect their advanced brain.,또 기이다란 머리털이 그들의\n고등한 뇌를 지키기 위해 자라나지.
TM_L0004,And here’s the really truly incredible part!,그리고 정말로 정말로 놀라운 부분은!
TM_L0005,Humans are colorful.\nJust like the dreams they have!,인간은 ‘색’이 아주 많다는 거야.\n그들이 꾸는 꿈처럼 말이야!
TM_L0006,"Hair, eyes, skin, all contain\ncolor like individual traces.","머리칼에도, 눈동자에도, 피부에도,\n각자만의 흔적 같은 색을 품고 있지."
TM_L0007,"The color of a young leaf, a clear sky,\nand your own skin is certainly beautiful.","흐드러지는 풀잎의 색, 선선한 하늘의 색,\n그리고 네 가죽의 색도 아름답지만."
TM_L0008,But I heard the colors of humans\nare inimitably beautiful.,인간의 색은 그와는 비교할\n수 없이 아름답다고 들었어.
TM_L0009,And I hear they add layers of unborn\ncolors with cloth and accessories!,"또 천이나 장식으로 피부를 덮어, 가지고\n태어나지 않은 색들도 마음껏 덧칠하고는 한대!"
TM_L0010,From what Red has told me...,레드의 말을 취합해서\n유추해 본 결과...
TM_L0011,Humans... look like this!,인간들은... 이렇게 생겼어!
TM_L0012,He said showing this would work. That only\nhumans have such a wonderful exterior.,이걸 보여 주면 알 거라고 했어. 이렇게\n멋진 외형을 가진 건 인간밖에 없다고 했거든.
TM_L0013,Have you ever seen a real human too?,너도 인간을 실제로 본 적이 있니?
TM_L0014,(Huh?),(어라?)
TM_L0015,(What is this?),(이게 대체 뭐지?)
TM_L0016,Well... you make me blush.\nSince I’m human?,그... 쑥스럽네. 내가 인간인걸?
TM_L0017,You’re human?,네가 인간이라고?
TM_L0018,... There’s no way.,... 말도 안 돼.
TM_L0019,Why not?|Believe it or not!,"Why not?|Believe it or not, it’s true!"
TM_L0020,Humans. Round head... two arms...,인간의 특성. 동그란\n머리... 팔 두 개....
TM_L0021,Two legs... flat body...,다리 두 개... 판판한 몸통....
TM_L0022,Color...ful. Oh?,색깔이 많... 다. 어라?
TM_L0023,Do you read words made\nof squiggly letters?,"너, 네모반듯하게 짜인\n문자로 된 글을 읽니?"
TM_L0024,"Well, of course.","그럼, 당연하지."
TM_L0025,And do you sing beautiful tunes?,너도 아름다운 노래를 하니?
TM_L0026,I can sing. (I don’t know about beautiful.)|Of course. My shower head is my biggest fan.,노래를 하긴 하지? (아름다운지는 모르겠지만...)|그럼! ‘샤워할 때 노래하기’ 내 주특기라고!
TM_L0027,And do you <i>hmmm</i>\nwhen you’re lost in thought?,너도 고민에 잠겼을 때 가만히 ‘음’\n같은 소리를 내기도 하니?
TM_L0028,Hmm... oh? I guess I do!,음... 어라? 그런 것 같아!
TM_L0029,Unbelievable.,말도 안 돼.
TM_L0030,Unbelievable!,말도 안 돼!
TM_L0031,I met a human! I did it? I did it!,인! 간을 만났어! 만났어? 만난 거야!
TM_L0032,"<nickname>, everyone on\nthe moon loves you!","<nickname>, 달에 있는\n모두가 너를 사랑해!"
TM_L0033,Human! Hu-man! HUMAN!,인간! 인 간! 인간이야!
TM_L0034,"Human <nickname>, my body pounds and my\nheart swivels, it’s just that nice to meet you.","인간 <nickname>, 몸이 콩콩 뛰고\n심장이 빙글 돌아갈 것처럼 반가워."
TM_L0035,How does one on Earth call\nthe color I see on your hair?,너의 이 머리카락에서 보여지는\n색은 지구에서 뭐라고 불려?
TM_L0036,That would be......,내 머리의 색은......
TM_L0037,I see! I won’t ever forget!,그렇구나! 결코 잊지 않을게!
TM_L0038,"Oh, oh, oh! <nickname>, I’m a blobby creature\nborn on the dark side of the Moon!","아, 아, 아! <nickname>, 나는\n달 뒤편에서 태어난 덩어리 괴물!"
TM_L0039,"I opened my eyes in a puddle of\nFilth from the dream factory,","비록 꿈 공장의 폐기물\n웅덩이 속에서 눈을 떴지만,"
TM_L0040,"but the first things that these eyes saw were\ndream marbles, iridescent and glowing.",그러한 나의 눈에 최초로 담긴\n것은 색색의 꿈 구슬들이었어.
TM_L0041,And though I have a unpleasant\nsticky body for the moment...,지금은 불쾌하고 끈적한\n몸을 가지고 있지만...
TM_L0042,I know that one day I will become\na beautiful dream of a human!,언젠가는 인간의 아름다운\n꿈이 될 것이라는 확신이 있어!
TM_L0043,"I don’t, actually... Nothing is certain and even\nin bliss I find myself wrapped in despair",실은 없어.... 아무것도 확실한 게 없어서\n환희 속에서도 절망에 휘어감기는 나지만
TM_L0044,but my hopes are unshaken.,하지만 소망만은 확고해.
TM_L0045,So... So...,그러니까... 그러니까....
TM_L0046,Could I ask a favor of you?,너에게 부탁을 하나 해도 될까?
TM_L0047,"Which... would be...?|Yes, what is it?","뭔... 데...?|응, 뭔데?"
TM_L0048,"Hmm, hmm, hem, hem!","음, 음, 흠, 흠!"
TM_L0049,"I, I, I want to become the best dream for\nhumans. Tell me everything about them!","나, 나, 인간을 위한 최고의 꿈이 되고\n싶어. 인간에 대한 모든 걸 알려줘!"
TM_L0050,I want take place in any old dusty\ncorner and observe you from behind.,어디서나 먼지 내려앉은 구석에 틀어박혀\n너의 뒷모습을 관찰하고 싶어.
TM_L0051,Let me record each and every vibrant\nmoment by your side always.,언제나 너의 곁에 함께하면서 생동하는\n모든 순간을 기록하게 해 줘.
TM_L0052,"I want to make you, human, happy!",인간인 너를 행복하게 해 주고 싶어!
TM_L0053,Hold on.,잠깐만.
TM_L0054,From henceforth I’ll be with you like\na sticky shadow! Forever and always!,"이제부터는 끈적한 그림자처럼\n내가 함께할게! 항상, 항상!"
TM_L0055,Hold on...!,잠깐만...!
TM_L0056,"Yes, yes?","응, 응?"
TM_L0057,"(24-hour surveillance? No thank you.)|(That’s nice, but how do I turn them down?)",(24시간 붙어 있는 건 부담스러워… 솔직히 말하자.)|(마음은 고맙지만… 둘러댈 만한 좋은 핑계가 없을까?)
TM_L0058,Being around each other\nall the time would be difficult.,항상 붙어 다니는 건 조금 무리야.
TM_L0059,"Humans respect each\nother’s privacy, you see.",인간에게는 각자의 오붓한 공간을\n존중해 주는 문화가 있거든.
TM_L0060,So it would be too much to\nobserve me every single day.,그래서 매일매일 나를 관찰하는\n건 무리일 수 있지만.
TM_L0061,There is so much more\nout there than just me.,세상에는 나 말고도\n여러 군상이 있어.
TM_L0062,If you want to learn everything about\nhumans... I think you’ll need more than me.,뭉치가 인간의 전부를 알고 싶은 거라면...\n나만으로는 부족하지 않을까.
TM_L0063,"You want to know about\nhumans as a whole, right?",‘인간’ 자체가 궁금한 거지?
TM_L0064,Then observing more humans\nwould be one way of doing that.,그렇다면 보다 많은 사람을\n관찰하는 것도 하나의 방법일 거야.
TM_L0065,Such as exploring the world outside...,바깥을 탐험한다거나....
TM_L0066,...!,...!
TM_L0067,...,...
TM_L0068,"I understand. You’re... kicking me out, right?",무슨 뜻인지 알겠어. 나를… 쫓아내려는 거지?
TM_L0069,But... I don’t think I’m meant to roam.,하지만... 내 적성은\n방랑자가 아닌 것 같아.
TM_L0070,"On the moon, my favorite spots were the\npalm of Red’s hand and Sir Cello’s plump belly.",달에서 지낼 때에도 나는 레드의 손바닥 안과\n첼로 경의 뱃살 위에 머무는 것을 가장 좋아했어.
TM_L0071,The world outside looks dangerous. No\nsecluded darkness to welcome me.,바깥은 위험해 보여. 창문 밖엔 나를 품어\n줄 비좁은 어둠이 없는 것 같았어.
TM_L0072,And I... I need that.,그래서 나에게는... 그게 필요해.
TM_L0073,So you need shelter.,안식처가 필요한 거구나.
TM_L0074,"That’s it. As long as I’m not\nbothering you, <nickname>.","응, 응. <nickname>의 방해꾼이\n되고 싶지는 않지만..."
TM_L0075,Hmm.,흠.
TM_L0076,"(i mean, Dot is growing on me.)|(I guess it can’t be helped...)",(안쓰러운 동시에... 조금은 귀여운 걸.)|(어쩔 수 없는 상황인 건가...)
TM_L0077,"And, and.","그리고, 그리고..."
TM_L0078,To say goodbye to the\nfirst human I’ve ever met.,내가 처음 만난 인간과\n영영 작별해야 한다니.
TM_L0079,Dot...,뭉치야...
TM_L0080,You’re the first alien creature\nI’ve ever met too.,뭉치도 내가 처음 만난 외계 괴물이야.
TM_L0081,(An alien in my room... I’m a little worried.)|(I’ve always dreamed of meeting an alien!),(끈적한 괴물이 내 방에... 조금은 걱정되지만.)|(외계 생명체와의 만남은 내가 평생을 꿈꿔 온 일이었다고!)
TM_L0082,(But so far no signs of turning into a\nmuscular monster with too much teeth.),(하지만 이빨이 많이 달린 근육\n괴물로 변할 것 같아 보이진 않지.)
TM_L0083,"(I’ll give Dot a place to stay,\nand spend some time together.)","(일단 지낼 곳을 내어 주고,\n함께 시간을 보내 보자.)"
TM_L0084,(I guess I have my very own E.T. now.),(이제 나에게도 E.T.나 월-E 같은 친구가 생기게 되는 걸까?)
TM_L0085,"Alright, Dot.","좋아, 뭉치."
TM_L0086,"I wouldn’t want you to roam the\ndangerous city with no place to go,","나도 네가 갈 곳도 없이\n위험천만한 도시를 헤매다,"
TM_L0087,and get trampled by people’s shoes without\nbeing able to lift a finger... (if you have one.),움직일 힘도 없이 구두 밑창에 밟히며\n고통받게 되는 건 보고 싶지 않아.
TM_L0088,"How about you observe humans out there,\nand return to the closet once you’re done?","밖에서 인간들을 관찰하되, 외출을 마치면\n내 장롱으로 돌아오는 걸로 하면 어때?"
TM_L0089,Just how did you come up\nwith a plan like that?,<nickname> 너는 어떻게 그런\n방법을 생각해 낸 거야?
TM_L0090,"Humans go out, and come home\nall the time. We call it taking a walk.","인간들은 자주 외출하고, 늘 집으로\n돌아오거든. 우리는 그걸 산책이라 불러."
TM_L0091,"Walk, walk, walk.\nAnd my very own corner.","산책, 산책, 산책.\n그리고 근사한 나의 공간."
TM_L0092,Life couldn’t be better!,이보다 좋을 수는 없어!
TM_L0093,(It’s nice to see Dot so happy.)|(Phew... I think that worked.),"(Well, I’m glad Dot seems to like it.)|(Phew... I think that worked.)"
TM_L0094,"It will help your human studies,\nand I’ll have a little companion...","뭉치의 인간 공부에도 도움이 되고,\n나에게도 작은 말동무가 생길 테니..."
TM_L0095,This will work for both of us.,서로에게 좋은 일일 거야.
TM_L0096,"Yes, yes. I’m certain of it.","응, 응. 분명 그럴 거야!"