Main,ScriptKey,LineKey,Background,Actor,AnimState,DotAnim,DotExpression,TextType,KorText,EngText,NextLineKey,AnimScene,AfterScript,DeathNote,LocTable,LocKey
3,80,278,main_door_open,Player,Main,,,text,"아무리 끔찍하고, 축축하고, 섬뜩할지언정, 나는 그\n악몽을 본거지 삼고 텐트를 친 다음 촛불을 켤 거야.","No matter how horrible, damp, and eerie,\nI’ll take shelter in that nightmare and light a candle.",279,,,,Main_Ch14,M14_L0278
3,80,279,main_door_open,Player,Main,,,text,"그렇게 나는 단박에 너를 알아볼 테고,","I’d recognize you in a heartbeat,",280,,,,Main_Ch14,M14_L0279
3,80,280,main_door_open,Player,Main,,,text,그건 그런 대로 괜찮고 아름다운 악몽일 거야.,"and that would make it\na fine, beautiful nightmare.",284,,,,Main_Ch14,M14_L0280
3,80,281,main_door_open,Player,Main,,,text,"설령 끔찍하고, 축축하고, 섬뜩할지언정, 나는 그\n악몽을 본거지 삼고 텐트를 친 다음 촛불을 켤 거야.","Even if it’s horrible, damp, and eerie,\nI’ll take shelter in that nightmare and light a candle.",282,,,,Main_Ch14,M14_L0281
3,80,282,main_door_open,Player,Main,,,text,넌 나에게 칠흑 같은 어둠 속에서도\n안락해지는 법을 알려 줬잖아.,You taught me how to\nfind peace in the pitch black.,283,,,,Main_Ch14,M14_L0282
3,80,283,main_door_open,Player,Main,,,text,그런 네가 들려 주는 마지막 이야기가\n어떻게 악몽일 수 있겠어?,So how could the final story you\nshare with me ever be a nightmare?,284,,,,Main_Ch14,M14_L0283
3,80,284,main_door_open,Dot,Main,,,text,<nickname>......,<nickname>......,285,,,,Main_Ch14,M14_L0284
3,80,285,main_door_open,Dot,Main,,face_eyeroll3,text,...,...,286,,,,Main_Ch14,M14_L0285
3,80,286,main_door_open,Dot,Main,body_move,face_smile,text,...,...,287,,,,Main_Ch14,M14_L0286
3,80,287,main_door_open,Dot,Main,body_default1,face_blink,text,"응, 정말 그렇네.","Yes, you really are right.",288,,,,Main_Ch14,M14_L0287
3,80,288,main_door_open,Player,Main,,,text,나의 새까맣고 동그란 괴물 친구.,"My pitch-black, round monster friend.",289,,,,Main_Ch14,M14_L0288
3,80,289,main_door_open,Player,Main,,,text,먼지만 쌓여 있던 내 방 구석진\n모퉁이에 찾아와 줘서 고마웠어.,Thank you for taking your place\nin that dusty corner of my room.,290,,,,Main_Ch14,M14_L0289
3,80,290,main_door_open,Player,Main,,,text,"난 아마... 불시에 두렵고 어지러워질 때마다, 과거에\n각인된 우리의 추억 속으로 뒷걸음질칠지도 몰라.",If I’m ever scared or dizzy... I may stumble\nback into our memories etched in the past.,291,,,,Main_Ch14,M14_L0290
3,80,291,main_door_open,Player,Main,,,text,"방 안이 유독 춥고 깜깜할 때, 햇살이 따갑고 피로하게\n느껴질 때, 내 안의 감정들이 기어코 버거워졌을 때.","When my room gets dark, when the sunlight\nhurts, when my emotions weigh me down.",292,,,,Main_Ch14,M14_L0291
3,80,292,main_door_open,Dot,Main,,,text,암흑 속에서 물장구치고 싶을 때.\n암흑에 질식할 것 같을 때에도.,When you feel like paddling in the dark.\nWhen the dark threatens to choke you.,293,,,,Main_Ch14,M14_L0292
3,80,293,main_door_open,Dot,Main,,,text,그치만 넌 그 추억 속에서 실낱 같은 힘을 되찾을 거야.,But you’ll find the smallest sliver of strength\nin the times we spent together.,294,,,,Main_Ch14,M14_L0293
3,80,294,main_door_open,Player,Main,,,text,"... 응, 너를 만났기에 더욱 선명해졌을 힘을.",... Yes. A strength only made\nstronger because I met you.,295,,,,Main_Ch14,M14_L0294
3,80,295,main_door_open,Player,Main,,,text,그렇게 두려워하면서도 멈추지 않을게.,"I’ll be afraid, but I won’t stop.",296,,,,Main_Ch14,M14_L0295
3,80,296,main_door_open,Player,,,,text,네가 암흑 속에서 몸소 그러했듯이.,Just like you in the pitch black.,297,,,,Main_Ch14,M14_L0296
3,80,297,main_door_open,Dot,Main,,,text,...,... Yes. Thank you for everything.,298,,,,Main_Ch14,M14_L0297
3,80,298,main_door_open,Dot,Main,body_move,,text,그때의 네가 뒤돌아본 우리의\n우정은 어떤 모습을 하고 있을까?,I wonder what our friendship will\nlook like when you look back?,299,,,,Main_Ch14,M14_L0298
3,80,299,main_door_open,Player,Main,body_default1,,text,나중에 만나게 되면 다 이야기해 줄게. 전부.,I’ll tell you all about it.\nWhen we see each other again.,300,,,,Main_Ch14,M14_L0299
3,80,300,main_door_open,Dot,Main,,,text,...,...,301,,,,Main_Ch14,M14_L0300
3,80,301,main_door_open,Dot,Main,,,text,<nickname>.,<nickname>.,302,,,,Main_Ch14,M14_L0301
3,80,302,main_door_open,Dot,Main,,,text,"나, 이번에는 내가 가진 ‘검정’의 가능성을 믿어 볼래.",I’ve decided to take a chance\non my ‘black’ and its possibilities.,303,,,,Main_Ch14,M14_L0302
3,80,303,main_door_open,Dot,Main,,,text,네가 줄곧 아껴 주었던 것이니까. 나의 검정에\n아로새겨질 너만의 의미를 기대하며...,You’ve cherished it this whole time. So I’ll\nlook forward to what you’ll etch on my black...,304,,,,Main_Ch14,M14_L0303
3,80,304,main_door_open,Dot,Main,,,text,"너의 검은 꿈이 될게.\n농도 짙고 확연한 검정이 되어,","And become your black dream.\nA thick, certain shade of black.",305,,,,Main_Ch14,M14_L0304
3,80,305,main_door_open,Dot,Main,,face_close_turn,text,너의 어느 밤을,And I’ll paint one of your nights,306,,,,Main_Ch14,M14_L0305
3,80,306,main_door_open,Dot,Main,,face_close,text,가장 안전하고 자유롭게\n휘몰아치는 암흑으로 물들일게.,with the safest swirling darkness.,307,,,,Main_Ch14,M14_L0306
3,80,307,main_door_open,Dot,Main,,,text,검은 꿈이 될게.,I’ll become a black dream!,308,,,,Main_Ch14,M14_L0307
3,80,308,main_door_open,Dot,Main,,,text,너의 검고 검은 꿈이...,Your black black dream...,309,,,,Main_Ch14,M14_L0308
3,80,309,main_door_open,Dot,Main,,face_blink,text,"이제 눈을 감아, <nickname>.","Now close your eyes, <nickname>.",,,,,Main_Ch14,M14_L0309